{
  "costs": [
    {
      "break_even_bps": 8175,
      "demand_service_ns": 4663,
      "displacement_refill_ns": 5227,
      "h2d_bytes": 0,
      "lead_ns": 926670,
      "predictor_compute_ns": 1903,
      "readiness": "HOST_READY",
      "scheduler_demand_delay_ns": 0,
      "speculative_service_ns": 5227,
      "storage_bytes": 208896,
      "transport": "BUFFERED",
      "utility_min_observations": 32,
      "utility_min_timely_successes": 53,
      "utility_window_predictions": 64
    },
    {
      "break_even_bps": 7900,
      "demand_service_ns": 150391,
      "displacement_refill_ns": 278216,
      "h2d_bytes": 0,
      "lead_ns": 926670,
      "predictor_compute_ns": 1903,
      "readiness": "HOST_READY",
      "scheduler_demand_delay_ns": 0,
      "speculative_service_ns": 278216,
      "storage_bytes": 208896,
      "transport": "DIRECT_IO",
      "utility_min_observations": 32,
      "utility_min_timely_successes": 51,
      "utility_window_predictions": 64
    },
    {
      "break_even_bps": 7013,
      "demand_service_ns": 21456,
      "displacement_refill_ns": 21994,
      "h2d_bytes": 208896,
      "lead_ns": 926670,
      "predictor_compute_ns": 1903,
      "readiness": "DEVICE_READY",
      "scheduler_demand_delay_ns": 0,
      "speculative_service_ns": 21994,
      "storage_bytes": 0,
      "transport": "HOST_TO_DEVICE",
      "utility_min_observations": 32,
      "utility_min_timely_successes": 45,
      "utility_window_predictions": 64
    },
    {
      "break_even_bps": 6961,
      "demand_service_ns": 26170,
      "displacement_refill_ns": 26839,
      "h2d_bytes": 208896,
      "lead_ns": 926670,
      "predictor_compute_ns": 1903,
      "readiness": "DEVICE_READY",
      "scheduler_demand_delay_ns": 0,
      "speculative_service_ns": 26839,
      "storage_bytes": 208896,
      "transport": "BUFFERED",
      "utility_min_observations": 32,
      "utility_min_timely_successes": 45,
      "utility_window_predictions": 64
    },
    {
      "break_even_bps": 7788,
      "demand_service_ns": 172722,
      "displacement_refill_ns": 299596,
      "h2d_bytes": 208896,
      "lead_ns": 926670,
      "predictor_compute_ns": 1903,
      "readiness": "DEVICE_READY",
      "scheduler_demand_delay_ns": 0,
      "speculative_service_ns": 299596,
      "storage_bytes": 208896,
      "transport": "DIRECT_IO",
      "utility_min_observations": 32,
      "utility_min_timely_successes": 50,
      "utility_window_predictions": 64
    }
  ],
  "profile_id": "phase10-mxfp4-fold2-previous-token-direct-io-host-ready",
  "schema_version": "expert-prefetch-profile-v1",
  "seed": [
    {
      "count": 241,
      "expert": 5,
      "layer": 1,
      "payload_bytes": 208896,
      "physical_bytes": 208896
    },
    {
      "count": 243,
      "expert": 6,
      "layer": 1,
      "payload_bytes": 208896,
      "physical_bytes": 208896
    },
    {
      "count": 269,
      "expert": 0,
      "layer": 1,
      "payload_bytes": 208896,
      "physical_bytes": 208896
    },
    {
      "count": 292,
      "expert": 1,
      "layer": 1,
      "payload_bytes": 208896,
      "physical_bytes": 208896
    },
    {
      "count": 340,
      "expert": 5,
      "layer": 2,
      "payload_bytes": 208896,
      "physical_bytes": 208896
    },
    {
      "count": 342,
      "expert": 7,
      "layer": 2,
      "payload_bytes": 208896,
      "physical_bytes": 208896
    },
    {
      "count": 356,
      "expert": 5,
      "layer": 7,
      "payload_bytes": 208896,
      "physical_bytes": 208896
    },
    {
      "count": 486,
      "expert": 3,
      "layer": 5,
      "payload_bytes": 208896,
      "physical_bytes": 208896
    },
    {
      "count": 556,
      "expert": 3,
      "layer": 6,
      "payload_bytes": 208896,
      "physical_bytes": 208896
    },
    {
      "count": 597,
      "expert": 6,
      "layer": 4,
      "payload_bytes": 208896,
      "physical_bytes": 208896
    },
    {
      "count": 613,
      "expert": 2,
      "layer": 5,
      "payload_bytes": 208896,
      "physical_bytes": 208896
    },
    {
      "count": 653,
      "expert": 4,
      "layer": 4,
      "payload_bytes": 208896,
      "physical_bytes": 208896
    },
    {
      "count": 662,
      "expert": 3,
      "layer": 7,
      "payload_bytes": 208896,
      "physical_bytes": 208896
    },
    {
      "count": 711,
      "expert": 5,
      "layer": 6,
      "payload_bytes": 208896,
      "physical_bytes": 208896
    }
  ],
  "selection": {
    "break_even_bps": 7900,
    "candidates_per_target": 1,
    "fold_index": 2,
    "matrix_version": 1,
    "policy": "PREVIOUS_TOKEN",
    "readiness": "HOST_READY",
    "temporal_window_tokens": 0,
    "transport": "DIRECT_IO",
    "tuning_digest": "dcf8e62023dbe586a56eec5f69f84e865e80711199c31187e4ed7a9777fda4c3"
  },
  "source": {
    "artifacts": [
      {
        "name": "mxfp4-cpu-prose-en-small.bin",
        "sha256": "ad65e2c2119c8170bd79184cd47e535ef862c71de7e30dfecf413be80afef9a5",
        "size": 14706
      },
      {
        "name": "mxfp4-cpu-code-en-small.bin",
        "sha256": "710b954c72551fb262656f4356f5239c78a961611368968ed0ea43a99614472c",
        "size": 29069
      },
      {
        "name": "mxfp4-cpu-narrative-en-large.bin",
        "sha256": "89e17b6f722f6dc24ffc6e2df28b441a36265d2f483648e5ebfe3d217540735b",
        "size": 164734
      },
      {
        "name": "mxfp4-cpu-narrative-es-large.bin",
        "sha256": "2c15345340c32003412281e0c64407fdabea3e7064d8882bb5330dec0489047d",
        "size": 187078
      },
      {
        "name": "phase2-k3-route-corpus-v1.tar.gz",
        "sha256": "6aa924a6c18bee4e2490f317ced836bcc4740c3ec63e9427a95951e79a649a5f",
        "size": 323723
      },
      {
        "name": "mxfp4-transport-break-even.json",
        "sha256": "8dd71f887555ddadd530cf2e25afccff7317ebb08cbabc696f3c00750cbac439",
        "size": 6819
      }
    ],
    "fold": {
      "index": 2,
      "test": "structured-en-small",
      "test_rows": 266,
      "training": [
        "prose-en-small",
        "code-en-small",
        "narrative-en-large",
        "narrative-es-large"
      ],
      "training_rows": 5187,
      "validation": "technical-en-large",
      "validation_rows": 2079
    },
    "kind": "route_trace"
  },
  "static_counts": [
    {
      "count": 269,
      "expert": 0,
      "layer": 1
    },
    {
      "count": 292,
      "expert": 1,
      "layer": 1
    },
    {
      "count": 65,
      "expert": 2,
      "layer": 1
    },
    {
      "count": 89,
      "expert": 3,
      "layer": 1
    },
    {
      "count": 139,
      "expert": 4,
      "layer": 1
    },
    {
      "count": 241,
      "expert": 5,
      "layer": 1
    },
    {
      "count": 243,
      "expert": 6,
      "layer": 1
    },
    {
      "count": 144,
      "expert": 7,
      "layer": 1
    },
    {
      "count": 106,
      "expert": 0,
      "layer": 2
    },
    {
      "count": 85,
      "expert": 1,
      "layer": 2
    },
    {
      "count": 234,
      "expert": 2,
      "layer": 2
    },
    {
      "count": 184,
      "expert": 3,
      "layer": 2
    },
    {
      "count": 81,
      "expert": 4,
      "layer": 2
    },
    {
      "count": 340,
      "expert": 5,
      "layer": 2
    },
    {
      "count": 110,
      "expert": 6,
      "layer": 2
    },
    {
      "count": 342,
      "expert": 7,
      "layer": 2
    },
    {
      "count": 175,
      "expert": 0,
      "layer": 3
    },
    {
      "count": 199,
      "expert": 1,
      "layer": 3
    },
    {
      "count": 136,
      "expert": 2,
      "layer": 3
    },
    {
      "count": 187,
      "expert": 3,
      "layer": 3
    },
    {
      "count": 180,
      "expert": 4,
      "layer": 3
    },
    {
      "count": 193,
      "expert": 5,
      "layer": 3
    },
    {
      "count": 232,
      "expert": 6,
      "layer": 3
    },
    {
      "count": 180,
      "expert": 7,
      "layer": 3
    },
    {
      "count": 8,
      "expert": 0,
      "layer": 4
    },
    {
      "count": 87,
      "expert": 1,
      "layer": 4
    },
    {
      "count": 46,
      "expert": 2,
      "layer": 4
    },
    {
      "count": 38,
      "expert": 3,
      "layer": 4
    },
    {
      "count": 653,
      "expert": 4,
      "layer": 4
    },
    {
      "count": 22,
      "expert": 5,
      "layer": 4
    },
    {
      "count": 597,
      "expert": 6,
      "layer": 4
    },
    {
      "count": 31,
      "expert": 7,
      "layer": 4
    },
    {
      "count": 41,
      "expert": 0,
      "layer": 5
    },
    {
      "count": 111,
      "expert": 1,
      "layer": 5
    },
    {
      "count": 613,
      "expert": 2,
      "layer": 5
    },
    {
      "count": 486,
      "expert": 3,
      "layer": 5
    },
    {
      "count": 147,
      "expert": 4,
      "layer": 5
    },
    {
      "count": 1,
      "expert": 5,
      "layer": 5
    },
    {
      "count": 12,
      "expert": 6,
      "layer": 5
    },
    {
      "count": 71,
      "expert": 7,
      "layer": 5
    },
    {
      "count": 4,
      "expert": 0,
      "layer": 6
    },
    {
      "count": 8,
      "expert": 1,
      "layer": 6
    },
    {
      "count": 95,
      "expert": 2,
      "layer": 6
    },
    {
      "count": 556,
      "expert": 3,
      "layer": 6
    },
    {
      "count": 16,
      "expert": 4,
      "layer": 6
    },
    {
      "count": 711,
      "expert": 5,
      "layer": 6
    },
    {
      "count": 18,
      "expert": 6,
      "layer": 6
    },
    {
      "count": 74,
      "expert": 7,
      "layer": 6
    },
    {
      "count": 123,
      "expert": 0,
      "layer": 7
    },
    {
      "count": 43,
      "expert": 1,
      "layer": 7
    },
    {
      "count": 43,
      "expert": 2,
      "layer": 7
    },
    {
      "count": 662,
      "expert": 3,
      "layer": 7
    },
    {
      "count": 230,
      "expert": 4,
      "layer": 7
    },
    {
      "count": 356,
      "expert": 5,